0,https://www.google.com/search?q=Twitch+scam+cases,Twitch+scam+cases
1,https://kotaku.com/thousands-of-twitch-scam-channels-are-still-trying-to-s-1842219702,Thousands Of Twitch Scam Channels Are Still Trying To ...
2,https://www.washingtonpost.com/video-games/2022/01/11/twitch-bit-money-laundering-turkey-police/,Twitch streamer money laundering scheme results in ...
3,https://www.washingtonpost.com/video-games/2022/01/11/twitch-bit-money-laundering-turkey-police/,Twitch streamer money laundering scheme results in ...
4,https://www.youtube.com/watch?v=AXFRTnwz8zw,This Is The Biggest Scam In Twitch History! $300000 Stolen!
5,https://win.gg/news/40-streamers-arrested-in-twitch-money-laundering-scam/,40 streamers arrested in Twitch money laundering scam
6,https://www.tweaktown.com/news/88547/biggest-scam-in-twitch-history-forces-platform-wide-ban-on-gambling/index.html,Biggest scam in Twitch history forces platform-wide ban on ...
7,https://www.sportskeeda.com/esports/5-streamers-who-ve-allegedly-scammed-viewers,5 streamers who've allegedly scammed their viewers
8,https://www.reddit.com/r/Twitch/comments/uabwjc/scam_or_no/,Scam or no : r/Twitch
9,https://www.svg.com/588679/this-twitch-streamer-was-scammed-out-of-thousands-of-dollars/,This Twitch Streamer Was Scammed Out Of Thousands ... - SVG
10,https://www.middleeasteye.net/news/turkey-twitch-money-laundering-fraud,Turkey: Hackers allegedly used streaming platform Twitch ...
