0,https://www.google.com/search?q=Crypto+scams+on+Twitch,Crypto+scams+on+Twitch
1,https://protos.com/crypto-gambling-livestreams-to-be-banned-from-twitch-after-200k-scam/,Crypto gambling livestreams to be banned from Twitch after ...
2,https://www.dexerto.com/tech/elon-musks-twitter-faces-australian-wrath-over-online-hate-2186082/,Twitch battles fake Elon Musk streams again with scam ...
3,https://news.trendmicro.com/2022/07/21/twitchgive-com-scam-or-legit/,TwitchGive[.]com Is a Scam
4,https://www.yahoo.com/entertainment/300-000-streamer-scam-fuels-170132026.html,$300000 Streamer Scam Prompts Twitch to Crack Down ...
5,https://dotesports.com/streaming/news/one-of-the-top-just-chatting-channels-on-twitch-is-a-bitcoin-scam-and-its-making-thousands,One of the top Just Chatting channels on Twitch is a bitcoin ...
6,https://www.esports.com/en/controversial-streamer-ice-poseidon-steals-500-000-from-fans-in-crypto-scam-320742,Controversial streamer Ice Poseidon steals $500.000 from ...
7,https://kotaku.com/dr-rachel-kowert-psychologist-game-violence-learning-1850477266,YouTuber Ice Poseidon Stole $500000 From Fans In ...
8,https://techcrunch.com/2022/09/20/twitch-sliker-gambling-drama/,Twitch responds to gambling scam drama by banning ...
9,https://www.gamingbible.com/news/games-twitch-alleged-cryptocurrency-scam-from-faze-clan-shocks-fans-20210702,Alleged Cryptocurrency Scam From FaZe Clan Shocks Fans
